{
  "name": "content-guards",
  "version": "6.3.0",
  "description": "Combined content validation and guard plugin: token-validator, markdown-validator, readme-validator, webfetch-guard, issue/PR backlog limiter, public-repo leakage guard, and script/wrapper-generation guards",
  "author": {
    "name": "JacobPEvans"
  },
  "license": "Apache-2.0",
  "keywords": [
    "hooks",
    "validation",
    "content-guards",
    "token-limits",
    "markdown",
    "readme",
    "webfetch",
    "issue-management",
    "backlog-limits",
    "code-quality"
  ],
  "skills": [
    "./skills/validate-readme",
    "./skills/native-first"
  ]
}
