{
  "name": "infra-orchestration",
  "version": "6.3.0",
  "description": "Cross-repo infrastructure orchestration for Terraform and Ansible workflows",
  "author": {
    "name": "JacobPEvans"
  },
  "license": "Apache-2.0",
  "repository": "https://github.com/JacobPEvans/claude-code-plugins",
  "keywords": [
    "infrastructure",
    "terraform",
    "ansible",
    "orchestration",
    "inventory",
    "e2e-testing"
  ],
  "skills": [
    "./skills/orchestrate-infra",
    "./skills/sync-inventory",
    "./skills/test-e2e"
  ]
}
