{
  "name": "attention-notify",
  "version": "1.1.2",
  "description": "Raise a local macOS banner for every PushNotification call and every attention-needed Notification event",
  "author": {
    "name": "JacobPEvans"
  },
  "license": "Apache-2.0",
  "repository": "https://github.com/JacobPEvans/claude-code-plugins",
  "keywords": [
    "hooks",
    "notification",
    "macos",
    "attention"
  ]
}
