{
  "name": "code-standards",
  "version": "6.3.0",
  "description": "Estate-specific code conventions not covered by generic review skills: logging format, monitoring-vs-test philosophy, doc format",
  "author": {
    "name": "JacobPEvans"
  },
  "license": "MIT",
  "repository": "https://github.com/JacobPEvans/claude-code-plugins",
  "keywords": [
    "code",
    "quality",
    "review",
    "testing",
    "documentation",
    "standards"
  ],
  "skills": [
    "./skills/code-quality-standards"
  ]
}
