{
  "name": "slack-channel",
  "version": "1.0.0",
  "description": "Two-way Slack thread channel for a Claude Code session: status, questions, permission prompts and approval links answered in one thread",
  "author": {
    "name": "JacobPEvans"
  },
  "license": "Apache-2.0",
  "repository": "https://github.com/JacobPEvans/claude-code-plugins",
  "keywords": [
    "slack",
    "channel",
    "socket-mode",
    "permission-relay",
    "hooks"
  ]
}
