{
  "name": "homelab-ops",
  "version": "1.1.0",
  "description": "Operational runbooks for infrastructure state, maintenance, and recovery: monitoring-first checks, Proxmox VE cluster operations, DNS ingress convergence, secrets-engine identity bring-up, Terrakube operations, PXE netboot installs, LLM router operations, workstation off-box backup, Dell iDRAC BMC operations, and resumable ZFS transfers",
  "author": {
    "name": "JacobPEvans"
  },
  "license": "MIT",
  "repository": "https://github.com/JacobPEvans/claude-code-plugins",
  "keywords": [
    "homelab",
    "runbook",
    "operations",
    "dns",
    "secrets"
  ],
  "skills": [
    "./skills/homelab-runbooks",
    "./skills/proxmox-cluster-ops",
    "./skills/monitoring-first",
    "./skills/terrakube-ops",
    "./skills/pxe-netboot",
    "./skills/llm-router-ops",
    "./skills/workstation-offbox-backup",
    "./skills/dell-idrac-bmc-ops",
    "./skills/zfs-resumable-transfers"
  ]
}
