{
  "name": "ansible",
  "version": "1.0.0",
  "description": "Ansible repository conventions for layout, linting, tests, shared dependencies, releases, and secret handling",
  "author": {
    "name": "JacobPEvans"
  },
  "license": "Apache-2.0",
  "repository": "https://github.com/JacobPEvans/claude-code-plugins",
  "keywords": [
    "ansible",
    "automation",
    "linting",
    "testing",
    "secrets"
  ],
  "skills": [
    "./skills/ansible-conventions"
  ]
}
