{
  "name": "git-workflows",
  "version": "6.4.0",
  "description": "Local Git standards and troubleshooting",
  "author": {
    "name": "JacobPEvans"
  },
  "license": "Apache-2.0",
  "repository": "https://github.com/JacobPEvans/claude-code-plugins",
  "keywords": [
    "git",
    "worktree",
    "sync",
    "branch",
    "workflow"
  ],
  "skills": [
    "./skills/troubleshoot-rebase",
    "./skills/troubleshoot-precommit",
    "./skills/troubleshoot-worktree",
    "./skills/pre-commit-architecture",
    "./skills/git-workflow-standards"
  ]
}
