{
  "name": "jpe-ai-delegation",
  "version": "1.3.1",
  "description": "Specific to the maintainer's own setup and not intended for general use.",
  "author": {
    "name": "JacobPEvans"
  },
  "license": "MIT",
  "repository": "https://github.com/JacobPEvans/claude-code-plugins",
  "keywords": [
    "ai",
    "delegation",
    "estate",
    "routing"
  ],
  "skills": [
    "./skills/delegation-ladder"
  ]
}
