{
  "name": "project-standards",
  "version": "6.3.0",
  "description": "Claude skill authoring standards, workspace management, and skills/tools registry lookup",
  "author": {
    "name": "JacobPEvans"
  },
  "license": "MIT",
  "repository": "https://github.com/JacobPEvans/claude-code-plugins",
  "keywords": [
    "claude",
    "authoring",
    "workspace",
    "skills",
    "registry",
    "standards"
  ],
  "skills": [
    "./skills/claude-skill-authoring",
    "./skills/workspace-standards",
    "./skills/skills-registry",
    "./skills/nix-tool-policy"
  ]
}
