{
  "name": "script-guards",
  "version": "6.2.2",
  "description": "Prevents unnecessary script generation - enforces research-first, native-tool-first patterns via PreToolUse and UserPromptSubmit hooks",
  "author": {
    "name": "JacobPEvans"
  },
  "homepage": "https://github.com/JacobPEvans/claude-code-plugins",
  "keywords": [
    "scripts",
    "guards",
    "direct-execution",
    "hooks",
    "nix",
    "inline-scripts"
  ],
  "license": "Apache-2.0",
  "skills": [
    "./skills/native-first"
  ]
}
