{
  "name": "ai-delegation",
  "version": "6.12.0",
  "description": "Delegate tasks to AI models, orchestrate premium-model work, and run autonomous maintenance loops",
  "author": {
    "name": "JacobPEvans"
  },
  "license": "Apache-2.0",
  "repository": "https://github.com/JacobPEvans/claude-code-plugins",
  "keywords": [
    "ai",
    "delegation",
    "multi-model",
    "orchestration",
    "autonomous",
    "maintenance"
  ],
  "skills": [
    "./skills/delegate-to-ai",
    "./skills/auto-maintain",
    "./skills/premium-agent-orchestration",
    "./skills/local-subagents",
    "./skills/fast-subagent",
    "./skills/openrouter-models",
    "./skills/multi-model-review"
  ]
}
