{
  "name": "cribl",
  "version": "1.0.0",
  "description": "Cribl pack conventions for structure, validation, tests, releases, and secret handling",
  "author": {
    "name": "JacobPEvans"
  },
  "license": "Apache-2.0",
  "repository": "https://github.com/JacobPEvans/claude-code-plugins",
  "keywords": [
    "cribl",
    "pack",
    "validation",
    "testing",
    "secrets"
  ],
  "skills": [
    "./skills/cribl-pack-conventions"
  ]
}
