{
  "name": "config-management",
  "version": "6.2.2",
  "description": "Sync AI tool permissions across repos and quickly add always-allow permissions",
  "author": {
    "name": "JacobPEvans"
  },
  "license": "Apache-2.0",
  "repository": "https://github.com/JacobPEvans/claude-code-plugins",
  "keywords": [
    "permissions",
    "config",
    "sync",
    "claude",
    "gemini",
    "management"
  ],
  "skills": [
    "./skills/sync-permissions",
    "./skills/quick-add-permission"
  ]
}
