{
  "name": "slack",
  "version": "5.10.1",
  "description": "Slack messaging from any AI CLI through a shell command instead of an MCP server: read, thread, send and search with an OpenBao-minted bot token that is never stored",
  "author": {
    "name": "JacobPEvans"
  },
  "license": "Apache-2.0",
  "repository": "https://github.com/JacobPEvans/claude-code-plugins",
  "keywords": [
    "slack",
    "messaging",
    "cli",
    "openbao",
    "no-mcp",
    "cross-harness"
  ],
  "skills": [
    "./skills/slack-messaging"
  ]
}
